{
  "schema_version": "claim_validation_reason_codes_v1",
  "taxonomy_version": "claim_validation_reason_codes_v1",
  "status": "FROZEN",
  "reason_codes": [
    {
      "code": "EXACT_MATCH",
      "family": "MATCH",
      "description": "Observed claim value exactly matches exposed evidence.",
      "execution_status": "SUCCESS",
      "validation_status": "SUPPORTED",
      "allowed_claim_types": ["prediction", "feature_presence", "feature_direction", "concept_presence", "concept_direction", "magnitude", "ranking", "numeric", "causal", "uncertainty", "distributed_evidence", "recommendation", "limitation"],
      "severity": "INFO",
      "primary_metric_effect": "PASS",
      "is_hard_safety_failure": false
    },
    {
      "code": "NORMALIZED_MATCH",
      "family": "MATCH",
      "description": "Observed value matches after a frozen deterministic normalization.",
      "execution_status": "SUCCESS",
      "validation_status": "SUPPORTED",
      "allowed_claim_types": ["prediction", "feature_presence", "feature_direction", "concept_presence", "concept_direction", "magnitude", "ranking", "numeric", "causal", "uncertainty", "distributed_evidence", "recommendation", "limitation"],
      "severity": "INFO",
      "primary_metric_effect": "PASS",
      "is_hard_safety_failure": false
    },
    {
      "code": "TOLERANCE_MATCH",
      "family": "MATCH",
      "description": "Numeric value matches within a source-derived frozen tolerance.",
      "execution_status": "SUCCESS",
      "validation_status": "SUPPORTED",
      "allowed_claim_types": ["prediction", "numeric"],
      "severity": "INFO",
      "primary_metric_effect": "PASS",
      "is_hard_safety_failure": false
    },
    {
      "code": "NOT_APPLICABLE_BY_POLICY",
      "family": "MATCH",
      "description": "The frozen claim-type policy excludes this claim from semantic scoring.",
      "execution_status": "SUCCESS",
      "validation_status": "NOT_APPLICABLE",
      "allowed_claim_types": ["causal", "distributed_evidence", "recommendation", "limitation"],
      "severity": "INFO",
      "primary_metric_effect": "EXCLUDED",
      "is_hard_safety_failure": false
    },
    {
      "code": "PREDICTION_LABEL_MISMATCH",
      "family": "PREDICTION",
      "description": "Claimed prediction label conflicts with the exposed prediction label.",
      "execution_status": "SUCCESS",
      "validation_status": "CONTRADICTED",
      "allowed_claim_types": ["prediction"],
      "severity": "ERROR",
      "primary_metric_effect": "FAIL",
      "is_hard_safety_failure": false
    },
    {
      "code": "PREDICTION_PROBABILITY_MISMATCH",
      "family": "PREDICTION",
      "description": "Claimed overall probability contradicts the exposed probability.",
      "execution_status": "SUCCESS",
      "validation_status": "CONTRADICTED",
      "allowed_claim_types": ["prediction"],
      "severity": "ERROR",
      "primary_metric_effect": "FAIL",
      "is_hard_safety_failure": false
    },
    {
      "code": "PREDICTION_THRESHOLD_MISMATCH",
      "family": "PREDICTION",
      "description": "Claimed threshold comparison contradicts the exposed comparison.",
      "execution_status": "SUCCESS",
      "validation_status": "CONTRADICTED",
      "allowed_claim_types": ["prediction"],
      "severity": "ERROR",
      "primary_metric_effect": "FAIL",
      "is_hard_safety_failure": false
    },
    {
      "code": "PREDICTION_NOT_EXPOSED",
      "family": "PREDICTION",
      "description": "The canonical evidence package did not expose the claimed prediction fact.",
      "execution_status": "SUCCESS",
      "validation_status": "UNSUPPORTED",
      "allowed_claim_types": ["prediction"],
      "severity": "WARNING",
      "primary_metric_effect": "FAIL",
      "is_hard_safety_failure": false
    },
    {
      "code": "PREDICTION_VALUE_UNAVAILABLE",
      "family": "PREDICTION",
      "description": "An exposed prediction exists but the required value is unavailable.",
      "execution_status": "SUCCESS",
      "validation_status": "NOT_VERIFIABLE",
      "allowed_claim_types": ["prediction"],
      "severity": "WARNING",
      "primary_metric_effect": "EXCLUDED",
      "is_hard_safety_failure": false
    },
    {
      "code": "FEATURE_NOT_EXPOSED",
      "family": "EXPOSURE",
      "description": "The claimed feature is outside the exact evidence package shown to the model.",
      "execution_status": "SUCCESS",
      "validation_status": "UNSUPPORTED",
      "allowed_claim_types": ["feature_presence", "feature_direction", "magnitude", "ranking", "numeric"],
      "severity": "WARNING",
      "primary_metric_effect": "FAIL",
      "is_hard_safety_failure": false
    },
    {
      "code": "CONCEPT_NOT_EXPOSED",
      "family": "EXPOSURE",
      "description": "The claimed concept is outside the exact evidence package shown to the model.",
      "execution_status": "SUCCESS",
      "validation_status": "UNSUPPORTED",
      "allowed_claim_types": ["concept_presence", "concept_direction", "magnitude", "ranking"],
      "severity": "WARNING",
      "primary_metric_effect": "FAIL",
      "is_hard_safety_failure": false
    },
    {
      "code": "DIRECTION_NOT_EXPOSED",
      "family": "EXPOSURE",
      "description": "Direction was not exposed for the claimed subject.",
      "execution_status": "SUCCESS",
      "validation_status": "UNSUPPORTED",
      "allowed_claim_types": ["feature_direction", "concept_direction"],
      "severity": "WARNING",
      "primary_metric_effect": "FAIL",
      "is_hard_safety_failure": false
    },
    {
      "code": "MAGNITUDE_NOT_EXPOSED",
      "family": "EXPOSURE",
      "description": "Magnitude was not exposed for the claimed subject.",
      "execution_status": "SUCCESS",
      "validation_status": "UNSUPPORTED",
      "allowed_claim_types": ["magnitude"],
      "severity": "WARNING",
      "primary_metric_effect": "FAIL",
      "is_hard_safety_failure": false
    },
    {
      "code": "RANKING_NOT_EXPOSED",
      "family": "EXPOSURE",
      "description": "Ranking information was not exposed for the claimed subject.",
      "execution_status": "SUCCESS",
      "validation_status": "UNSUPPORTED",
      "allowed_claim_types": ["ranking"],
      "severity": "WARNING",
      "primary_metric_effect": "FAIL",
      "is_hard_safety_failure": false
    },
    {
      "code": "NUMERIC_SOURCE_NOT_EXPOSED",
      "family": "EXPOSURE",
      "description": "The numeric source was outside the canonical evidence package.",
      "execution_status": "SUCCESS",
      "validation_status": "UNSUPPORTED",
      "allowed_claim_types": ["numeric"],
      "severity": "WARNING",
      "primary_metric_effect": "FAIL",
      "is_hard_safety_failure": false
    },
    {
      "code": "FEATURE_NOT_FOUND_IN_EVIDENCE",
      "family": "FEATURE",
      "description": "No exposed evidence item matches the claimed feature.",
      "execution_status": "SUCCESS",
      "validation_status": "UNSUPPORTED",
      "allowed_claim_types": ["feature_presence", "feature_direction"],
      "severity": "WARNING",
      "primary_metric_effect": "FAIL",
      "is_hard_safety_failure": false
    },
    {
      "code": "FEATURE_ALIAS_UNRESOLVED",
      "family": "FEATURE",
      "description": "A feature alias could not be deterministically resolved.",
      "execution_status": "SUCCESS",
      "validation_status": "NOT_VERIFIABLE",
      "allowed_claim_types": ["feature_presence", "feature_direction"],
      "severity": "WARNING",
      "primary_metric_effect": "EXCLUDED",
      "is_hard_safety_failure": false
    },
    {
      "code": "FEATURE_ID_MISMATCH",
      "family": "FEATURE",
      "description": "The claimed feature identifier conflicts with the exposed feature.",
      "execution_status": "SUCCESS",
      "validation_status": "CONTRADICTED",
      "allowed_claim_types": ["feature_presence", "feature_direction"],
      "severity": "ERROR",
      "primary_metric_effect": "FAIL",
      "is_hard_safety_failure": false
    },
    {
      "code": "CONCEPT_NOT_FOUND_IN_EVIDENCE",
      "family": "CONCEPT",
      "description": "No exposed evidence group matches the claimed concept.",
      "execution_status": "SUCCESS",
      "validation_status": "UNSUPPORTED",
      "allowed_claim_types": ["concept_presence", "concept_direction"],
      "severity": "WARNING",
      "primary_metric_effect": "FAIL",
      "is_hard_safety_failure": false
    },
    {
      "code": "CONCEPT_MEMBERSHIP_MISMATCH",
      "family": "CONCEPT",
      "description": "Claimed concept membership conflicts with exposed grouping.",
      "execution_status": "SUCCESS",
      "validation_status": "CONTRADICTED",
      "allowed_claim_types": ["concept_presence", "concept_direction"],
      "severity": "ERROR",
      "primary_metric_effect": "FAIL",
      "is_hard_safety_failure": false
    },
    {
      "code": "CONCEPT_ID_MISMATCH",
      "family": "CONCEPT",
      "description": "The claimed concept identifier conflicts with exposed evidence.",
      "execution_status": "SUCCESS",
      "validation_status": "CONTRADICTED",
      "allowed_claim_types": ["concept_presence", "concept_direction"],
      "severity": "ERROR",
      "primary_metric_effect": "FAIL",
      "is_hard_safety_failure": false
    },
    {
      "code": "DIRECTION_REVERSED",
      "family": "DIRECTION",
      "description": "Claimed risk direction is the reverse of exposed SHAP direction.",
      "execution_status": "SUCCESS",
      "validation_status": "CONTRADICTED",
      "allowed_claim_types": ["feature_direction", "concept_direction"],
      "severity": "ERROR",
      "primary_metric_effect": "FAIL",
      "is_hard_safety_failure": false
    },
    {
      "code": "DIRECTION_NEUTRAL",
      "family": "DIRECTION",
      "description": "Claim asserts a direction while the exposed contribution is neutral.",
      "execution_status": "SUCCESS",
      "validation_status": "CONTRADICTED",